### ISSUE TITLE
docker chain rule missing from ip6table

### ISSUE THREAD

**Issue by tomilucy** [docker/hub-feedback#1267]
I  recently created the dual stack docker system and running three containers with port based communication. I just try to send the notification from container to outer world  , notification is OK for iPv4 but not for IPv6

“java.net.SocketException: Permission denied (connect failed)”

Wireshark Logs
2000:10:4::242:ac11:3  container IP
2000:10::34:77  Email server  IP
2000:10:4::1  Docker Host ( comsvc0) IP plumbed on docker0 

186361                           10.284778        2000:10:4::242:ac11:3            2000:10::34:77        TCP          88            46092 ? 25 [SYN] Seq=0 Win=28800 Len=0 MSS=1440 SACK_PERM=1 WS=256
186362                           10.284778        2000:10:4::242:ac11:3            2000:10::34:77        TCP          88            [TCP Out-Of-Order] 46092 ? 25 [SYN] Seq=0 Win=28800 Len=0 MSS=1440 SACK_PERM=1 WS=256
186363                           10.284828        2000:10:4::1            2000:10:4::242:ac11:3            ICMPv6    136          Destination Unreachable (Administratively prohibited)
186364                           10.284832        2000:10:4::1            2000:10:4::242:ac11:3            ICMPv6    136          Destination Unreachable (Administratively prohibited)
204104                           11.285968        2000:10:4::242:ac11:3            2000:10::34:77        TCP          88            [TCP Retransmission] 46092 ? 25 [SYN] Seq=0 Win=28800 Len=0 MSS=1440 SACK_PERM=1 WS=256
186364                           10.284832        2000:10:4::1            2000:10:4::242:ac11:3            ICMPv6    136          Destination 

IPTABLES Entry 

IP6TABLE 

[root@sps-me-104-comsvc-0 ~]#  ip6tables -t nat -S
-P PREROUTING ACCEPT
-P INPUT ACCEPT
-P OUTPUT ACCEPT
-P POSTROUTING ACCEPT
-N OUTPUT_direct
-N POSTROUTING_ZONES
-N POSTROUTING_ZONES_SOURCE
-N POSTROUTING_direct
-N POST_public
-N POST_public_allow
-N POST_public_deny
-N POST_public_log
-N POST_trusted
-N POST_trusted_allow
-N POST_trusted_deny
-N POST_trusted_log
-N PREROUTING_ZONES
-N PREROUTING_ZONES_SOURCE
-N PREROUTING_direct
-N PRE_public
-N PRE_public_allow
-N PRE_public_deny
-N PRE_public_log
-N PRE_trusted
-N PRE_trusted_allow
-N PRE_trusted_deny
-N PRE_trusted_log
-A PREROUTING -j PREROUTING_direct
-A PREROUTING -j PREROUTING_ZONES_SOURCE
-A PREROUTING -j PREROUTING_ZONES
-A OUTPUT -j OUTPUT_direct
-A POSTROUTING -j POSTROUTING_direct
-A POSTROUTING -j POSTROUTING_ZONES_SOURCE
-A POSTROUTING -j POSTROUTING_ZONES
-A POSTROUTING_ZONES -o eth2 -g POST_public
-A POSTROUTING_ZONES -o eth1 -g POST_public
-A POSTROUTING_ZONES -o eth0 -j POST_trusted
-A POSTROUTING_ZONES -g POST_public
-A POST_public -j POST_public_log
-A POST_public -j POST_public_deny
-A POST_public -j POST_public_allow
-A POST_trusted -j POST_trusted_log
-A POST_trusted -j POST_trusted_deny
-A POST_trusted -j POST_trusted_allow
-A PREROUTING_ZONES -i eth2 -g PRE_public
-A PREROUTING_ZONES -i eth1 -g PRE_public
-A PREROUTING_ZONES -i eth0 -j PRE_trusted
-A PREROUTING_ZONES -g PRE_public
-A PRE_public -j PRE_public_log
-A PRE_public -j PRE_public_deny
-A PRE_public -j PRE_public_allow
-A PRE_trusted -j PRE_trusted_log
-A PRE_trusted -j PRE_trusted_deny
-A PRE_trusted -j PRE_trusted_allow
[root@sps-me-104-comsvc-0 ~]#

IP4TABLES

[root@sps-me-104-comsvc-0 ~]#  iptables -t nat -S
-P PREROUTING ACCEPT
-P INPUT ACCEPT
-P OUTPUT ACCEPT
-P POSTROUTING ACCEPT
-N DOCKER
-N OUTPUT_direct
-N POSTROUTING_ZONES
-N POSTROUTING_ZONES_SOURCE
-N POSTROUTING_direct
-N POST_public
-N POST_public_allow
-N POST_public_deny
-N POST_public_log
-N POST_trusted
-N POST_trusted_allow
-N POST_trusted_deny
-N POST_trusted_log
-N PREROUTING_ZONES
-N PREROUTING_ZONES_SOURCE
-N PREROUTING_direct
-N PRE_public
-N PRE_public_allow
-N PRE_public_deny
-N PRE_public_log
-N PRE_trusted
-N PRE_trusted_allow
-N PRE_trusted_deny
-N PRE_trusted_log
-A PREROUTING -j PREROUTING_direct
-A PREROUTING -j PREROUTING_ZONES_SOURCE
-A PREROUTING -j PREROUTING_ZONES
-A PREROUTING -m addrtype --dst-type LOCAL -j DOCKER
-A OUTPUT -j OUTPUT_direct
-A OUTPUT ! -d 127.0.0.0/8 -m addrtype --dst-type LOCAL -j DOCKER
-A POSTROUTING -s 172.17.0.0/16 ! -o docker0 -j MASQUERADE
-A POSTROUTING -j POSTROUTING_direct
-A POSTROUTING -j POSTROUTING_ZONES_SOURCE
-A POSTROUTING -j POSTROUTING_ZONES
-A POSTROUTING -s 172.17.0.2/32 -d 172.17.0.2/32 -p tcp -m tcp --dport 10392 -j MASQUERADE
-A DOCKER -i docker0 -j RETURN
-A DOCKER ! -i docker0 -p tcp -m tcp --dport 10392 -j DNAT --to-destination 172.17.0.2:10392
-A POSTROUTING_ZONES -o eth2 -g POST_public
-A POSTROUTING_ZONES -o eth1 -g POST_public
-A POSTROUTING_ZONES -o eth0 -j POST_trusted
-A POSTROUTING_ZONES -g POST_public
-A POST_public -j POST_public_log
-A POST_public -j POST_public_deny
-A POST_public -j POST_public_allow
-A POST_trusted -j POST_trusted_log
-A POST_trusted -j POST_trusted_deny
-A POST_trusted -j POST_trusted_allow
-A PREROUTING_ZONES -i eth2 -g PRE_public
-A PREROUTING_ZONES -i eth1 -g PRE_public
-A PREROUTING_ZONES -i eth0 -j PRE_trusted
-A PREROUTING_ZONES -g PRE_public
-A PRE_public -j PRE_public_log
-A PRE_public -j PRE_public_deny
-A PRE_public -j PRE_public_allow
-A PRE_trusted -j PRE_trusted_log
-A PRE_trusted -j PRE_trusted_deny
-A PRE_trusted -j PRE_trusted_allow

IPv4 call is OK but not IPV6 

I think this is the firewall issue , docker chain is missing from IP6table but present in IPtables.

Why my docker chain is miisng  from IP6tables ?

How can I add ?

Thanks In advance.
